{
  "id": "dorannia",
  "name": "Dorannia",
  "sector": "Spinward Marches",
  "subsector": "District 268",
  "hex": "1525",
  "uwp": "B8B4643-9",
  "tradeCodes": ["Fl", "Ni"],
  "allegiance": "Im",
  "bases": [],
  "stellar": {
    "primary": "K4 V",
    "type": "Single"
  },
  "worlds": 7,
  "gasGiants": 3,
  "planetoidBelts": 1,
  "notes": "Exotic fluid-ocean world with methane atmosphere. Mining colony. Jump point for travel to Sword Worlds border.",
  "wikiUrl": "https://wiki.travellerrpg.com/Dorannia_(world)",

  "celestialObjects": [
    {
      "id": "dorannia-star",
      "name": "Dorannia Primary",
      "type": "Star",
      "orbitAU": 0,
      "bearing": 0,
      "stellarClass": "K4 V",
      "stellarInfo": {
        "temperature": "4,440-4,600 K",
        "luminosity": "0.33 Solar",
        "mass": "0.73 Solar",
        "habitableZone": "0.5-0.7 AU",
        "description": "An orange main sequence dwarf star. Relatively cool and stable."
      },
      "transponder": "NONE",
      "gmNotes": "K4 V orange main sequence star. Mass 0.73 Sol, Luminosity 0.33."
    },
    {
      "id": "dorannia-mainworld",
      "name": "Dorannia",
      "type": "Planet",
      "orbitAU": 0.57,
      "orbitKm": 85000000,
      "bearing": 270,
      "uwp": "B8B4643-9",
      "tradeCodes": ["Fl", "Ni"],
      "atmosphere": "Corrosive (Methane)",
      "breathable": false,
      "inGoldilocks": false,
      "transponder": "DORANNIA BEACON",
      "gmNotes": "Large world with corrosive methane atmosphere. Fluid oceans. Pop ~3 million. TL9. Mining colony."
    },
    {
      "id": "dorannia-highport",
      "name": "Dorannia Highport",
      "type": "Station",
      "parent": "dorannia-mainworld",
      "orbitKm": 400,
      "bearing": 268,
      "uwp": "B8B4643-9",
      "transponder": "DORANNIA STARPORT ONE",
      "gmNotes": "Class B starport. Good facilities. Refined fuel available.",
      "celestial": false
    },
    {
      "id": "dorannia-belt",
      "name": "Dorannia Belt",
      "type": "Planetoid Belt",
      "orbitAU": 1.2,
      "orbitKm": 180000000,
      "bearing": 90,
      "transponder": "NONE",
      "gmNotes": "Main planetoid belt. Mining operations."
    },
    {
      "id": "dorannia-gg1",
      "name": "Dorannia Gas Giant I",
      "type": "Gas Giant",
      "orbitAU": 2.5,
      "orbitKm": 375000000,
      "bearing": 45,
      "transponder": "NONE",
      "gmNotes": "Inner gas giant. Good for wilderness refueling."
    },
    {
      "id": "dorannia-gg2",
      "name": "Dorannia Gas Giant II",
      "type": "Gas Giant",
      "orbitAU": 5.0,
      "orbitKm": 750000000,
      "bearing": 180,
      "transponder": "NONE",
      "gmNotes": "Middle gas giant."
    },
    {
      "id": "dorannia-gg3",
      "name": "Dorannia Gas Giant III",
      "type": "Gas Giant",
      "orbitAU": 12.0,
      "orbitKm": 1800000000,
      "bearing": 315,
      "transponder": "NONE",
      "gmNotes": "Outer gas giant."
    }
  ],

  "locations": [
    {
      "id": "loc-exit-jump",
      "name": "Exit Jump Space",
      "type": "jump_point",
      "x": 100,
      "y": 300,
      "actions": ["scan", "plot_course"],
      "travelTimeHours": {}
    },
    {
      "id": "loc-system-jump",
      "name": "System Departure Jump Point",
      "type": "jump_point",
      "linkedTo": "dorannia-star",
      "x": 50,
      "y": 150,
      "actions": ["jump", "scan"],
      "travelTimeHours": { "loc-exit-jump": 8, "loc-mainworld-jump": 12 }
    },
    {
      "id": "loc-mainworld-jump",
      "name": "Mainworld Departure Jump Point",
      "type": "jump_point",
      "linkedTo": "dorannia-mainworld",
      "x": 500,
      "y": 280,
      "actions": ["jump", "scan"],
      "travelTimeHours": { "loc-orbit-mainworld": 4 }
    },
    {
      "id": "loc-orbit-mainworld",
      "name": "Orbit - Dorannia",
      "type": "orbit",
      "linkedTo": "dorannia-mainworld",
      "x": 450,
      "y": 300,
      "actions": ["scan", "launch_craft", "dock"],
      "travelTimeHours": { "loc-dock-highport": 1, "loc-mainworld-jump": 4 }
    },
    {
      "id": "loc-dock-highport",
      "name": "Dock - Dorannia Highport",
      "type": "dock",
      "linkedTo": "dorannia-highport",
      "x": 460,
      "y": 310,
      "actions": ["refuel_refined", "repair", "trade", "passengers", "undock"],
      "travelTimeHours": { "loc-orbit-mainworld": 1 }
    },
    {
      "id": "loc-fuel-gg1",
      "name": "Fuel Skim - Gas Giant I",
      "type": "fuel_skim",
      "linkedTo": "dorannia-gg1",
      "x": 300,
      "y": 150,
      "actions": ["refuel_unrefined", "scan"],
      "travelTimeHours": { "loc-orbit-mainworld": 24 }
    },
    {
      "id": "loc-fuel-gg2",
      "name": "Fuel Skim - Gas Giant II",
      "type": "fuel_skim",
      "linkedTo": "dorannia-gg2",
      "x": 250,
      "y": 450,
      "actions": ["refuel_unrefined", "scan"],
      "travelTimeHours": { "loc-orbit-mainworld": 36 }
    },
    {
      "id": "loc-fuel-gg3",
      "name": "Fuel Skim - Gas Giant III",
      "type": "fuel_skim",
      "linkedTo": "dorannia-gg3",
      "x": 100,
      "y": 100,
      "actions": ["refuel_unrefined", "scan"],
      "travelTimeHours": { "loc-orbit-mainworld": 72 }
    },
    {
      "id": "loc-hide-belt",
      "name": "Hide - Asteroid Belt",
      "type": "hide",
      "linkedTo": "dorannia-belt",
      "x": 550,
      "y": 200,
      "actions": ["hide", "scan", "mine"],
      "travelTimeHours": { "loc-orbit-mainworld": 18 }
    },
    {
      "id": "loc-deep-outer",
      "name": "Deep Space (Outer System)",
      "type": "space",
      "x": 50,
      "y": 50,
      "actions": ["scan", "hide"],
      "travelTimeHours": { "loc-system-jump": 6 }
    },
    {
      "id": "loc-deep-inner",
      "name": "Deep Space (Inner System)",
      "type": "space",
      "x": 350,
      "y": 250,
      "actions": ["scan", "hide"],
      "travelTimeHours": { "loc-orbit-mainworld": 12 }
    }
  ],

  "roleContent": {
    "captain": "Rumors of Garoovian bounty hunters frequenting the system. Keep a low profile.",
    "astrogator": "Good jump routes to Ator (J-1) or direct to Flammarion (J-2). Review approach vectors.",
    "pilot": "Fluid oceans make landing dangerous. Orbital docking recommended.",
    "engineer": "Fuel skimming from gas giant possible. Recommend refined fuel from starport.",
    "sensors": "High methane atmosphere creates sensor distortion near planet. Clear readings in outer system.",
    "gunner": "Target practice asteroids in the belt. Request authorization from Captain.",
    "medic": "Methane atmosphere exposure requires decontamination protocols.",
    "steward": "Limited passenger traffic. Mining crews may need transport.",
    "cargo": "Processed methane exports. Mining equipment imports."
  },

  "news": [
    {
      "headline": "MINING OUTPUT INCREASES 12%",
      "source": "Dorannia Mining Consortium",
      "content": "Q3 production figures exceed projections. Methane exports to rimward systems continue to grow."
    },
    {
      "headline": "STARPORT UPGRADES APPROVED",
      "source": "Subsector News Wire",
      "content": "Dorannia Highport receives funding for berthing expansion. Work expected to complete 1106."
    },
    {
      "headline": "TRAVEL ADVISORY: SWORD WORLDS BORDER",
      "source": "Imperial Travel Bureau",
      "content": "Heightened naval activity along Sword Worlds frontier. Commercial vessels advised to verify documentation."
    }
  ],

  "mail": {
    "captain": {
      "from": "Anonymous Source",
      "subject": "Warning",
      "content": "Word is that Garoovian agents have been asking questions at the last three starports. They know your ship. Consider a new transponder code. - A Friend"
    },
    "astrogator": {
      "from": "Spinward Main Navigation Guild",
      "subject": "Updated Route Data",
      "content": "Attached: Latest jump calibration data for the Ator-Flammarion corridor. Binary star corrections included."
    },
    "engineer": {
      "from": "Drive Tech Quarterly",
      "subject": "Recall Notice",
      "content": "Your ship model may be affected by the TL9 fuel processor seal recall. Inspection recommended at next class A port."
    },
    "medic": {
      "from": "Sector Health Authority",
      "subject": "Medical Advisory",
      "content": "Tainted atmosphere exposure protocols updated. New decontamination procedures effective immediately."
    }
  }
}
